{
  "result": "pass",
  "min_donor_count": 10,
  "max_scatter": 3,
  "sources_scanned": 42,
  "token_files": ["src/styles/tokens.css"],
  "checks": [
    {"color": "rgb(6, 7, 10)", "donor_count": 7352, "token_layer_occurrences": 1, "scattered_occurrences": 0, "result": "pass"},
    {"color": "rgb(255, 255, 255)", "donor_count": 2831, "token_layer_occurrences": 1, "scattered_occurrences": 2, "result": "pass"}
  ],
  "issues": []
}
